text,category,cleaned_text,char_count,word_count
"Never have we ever been into such as filthy, serivce-lacking beach resort.  The whole premises is a run-down.  The restaurants are not clean: sticky tables covered with juice stains; rotten salad, bread crumbs and fish bones seem to be part of the chairs and cushions.  Serving beverages with cracked cups/glasses which also have dead insects gluing to them.  The food is not well prepared neither fresh, including the seafood!  Annoyed to be served with stale seafood in a beach resot!  Hotel beach is decorated with trash, including broken bottles.  Guests pay 5-star-resort tariff while 1-star serive is provided.",Recreation,never have we ever been into such a filthy serivcelacking beach resort the whole premise is a rundown the restaurant are not clean sticky table covered with juice stain rotten salad bread crumb and fish bone seem to be part of the chair and cushion serving beverage with cracked cupsglasses which also have dead insect gluing to them the food is not well prepared neither fresh including the seafood annoyed to be served with stale seafood in a beach resot hotel beach is decorated with trash including broken bottle guest pay starresort tariff while star serive is provided,616,98
"We felt we could not relax whilst in the grounds, the local sellers both men and women, hid in the bushes of the hotel on the beach, waiting to get people's attention.  As soon as you stepped onto the beach, you were surrounded by them.  Also so much rubbish strewn about the perimeter.  Overall the hotel lacked any atmosphere, maybe it is too large for that?
The staff were all lovely and friendly.  For the money we both felt very let down, it is marked as a 5 star hotel but I would disagree with that.",Recreation,we felt we could not relax whilst in the ground the local seller both men and woman hid in the bush of the hotel on the beach waiting to get people attention a soon a you stepped onto the beach you were surrounded by them also so much rubbish strewn about the perimeter overall the hotel lacked any atmosphere maybe it is too large for that the staff were all lovely and friendly for the money we both felt very let down it is marked a a star hotel but i would disagree with that,507,96
"Our planned highlight, to the end of our Sri Lankan tour, was a frustrating disappointment.  We arrived tired and sick, hoping for a clean comfortable room and some simple food.  Even though we had booked and paid 6 months earlier, it took a long time to allocate us a room.  The room smelled of mould and mould was easily found in the bathroom. My wife complained, but all the staff could do was find the missing outdoor furniture. At dinner, the first night, we had difficulty finding plain food, that would not aggravate our upset stomachs.  The chef kindly offered to prepare mashed potatoes, peas and grilled chicken, for us, the next night. However, the next day, this offer was undone by management, who declared we had been selected for ""Fine dining"". Fearing this was Sringlish for extra spicy, we gave up and went to bed early, without dinned, which we had already paid for.  At least at checkout, as some compensation, the hotel did not charge for the sandwich and hamburger, we had at the bar.  After my wife presented mouldy toiletries to management, they did offer to change rooms, on the second day; but it was too little too late.  The hotel has an impressive entrance and sea view.  But what good are those when the hotel fails the basics of room and food.",Recreation,our planned highlight to the end of our sri lankan tour wa a frustrating disappointment we arrived tired and sick hoping for a clean comfortable room and some simple food even though we had booked and paid month earlier it took a long time to allocate u a room the room smelled of mould and mould wa easily found in the bathroom my wife complained but all the staff could do wa find the missing outdoor furniture at dinner the first night we had difficulty finding plain food that would not aggravate our upset stomach the chef kindly offered to prepare mashed potato pea and grilled chicken for u the next night however the next day this offer wa undone by management who declared we had been selected for fine dining fearing this wa sringlish for extra spicy we gave up and went to bed early without dinned which we had already paid for at least at checkout a some compensation the hotel did not charge for the sandwich and hamburger we had at the bar after my wife presented mouldy toiletry to management they did offer to change room on the second day but it wa too little too late the hotel ha an impressive entrance and sea view but what good are those when the hotel fails the basic of room and food,1273,226
"I thought the ""fine dining"" restaurant was disappointing and over-priced. The hotel felt too ""Buckland's Holiday Camp"" for me. Couldn't wait to leave each day on other activities outside the hotel. It looked to me also that the original building design had been messed with. The model airplane at the end of the 'infinity"" pool was ridiculous. Surely Geofrey bawa would not have approved.",Rooms,i thought the fine dining restaurant wa disappointing and overpriced the hotel felt too bucklands holiday camp for me couldnt wait to leave each day on other activity outside the hotel it looked to me also that the original building design had been messed with the model airplane at the end of the infinity pool wa ridiculous surely geofrey bawa would not have approved,388,64
"I thought the ""fine dining"" restaurant was disappointing and over-priced. The hotel felt too ""Buckland's Holiday Camp"" for me. Couldn't wait to leave each day on other activities outside the hotel. It looked to me also that the original building design had been messed with. The model airplane at the end of the 'infinity"" pool was ridiculous. Surely Geofrey bawa would not have approved.",Rooms,i thought the fine dining restaurant wa disappointing and overpriced the hotel felt too bucklands holiday camp for me couldnt wait to leave each day on other activity outside the hotel it looked to me also that the original building design had been messed with the model airplane at the end of the infinity pool wa ridiculous surely geofrey bawa would not have approved,388,64
Great Location. Ancient old rooms & poor Service.,Rooms,great location ancient old room poor service,49,8
Relaxing day with great service and facilities all around,Rooms,relaxing day with great service and facility all around,57,9
Didnt enjoy the food,Food,didnt enjoy the food,20,4
great location and beautiful beach,Rooms,great location and beautiful beach,34,5
BEWARE THE BEACH GANGS,Recreation,beware the beach gang,22,4
Terrible experience with shameful behaviour from staff,Services,terrible experience with shameful behaviour from staff,54,7
"Potential to be great and probably once was, but not now !",Food,potential to be great and probably once wa but not now,58,12
Nice beach location,Rooms,nice beach location,19,3
Great location and property......below average food and service,Services,great location and propertybelow average food and service,63,8
Great premises but room was small,Rooms,great premise but room wa small,33,6
"If you want to relax at a construction site, this is the place for you!!!!",Rooms,if you want to relax at a construction site this is the place for you,74,15
